{
  "credit_adjustment_presentment_contract_version": 1,
  "credit_adjustment_id": "019d7b92-1aa0-7a7f-b61c-962c0f4bf660",
  "tenant_reference": "urn:cwl:tenant_001",
  "invoice_draft_id": "019d7b92-1aa0-7a7f-b61c-962c0f4bf620",
  "currency_code": "USD",
  "credit_amount": "0.003705",
  "tax_exclusive_amount": "0.003705",
  "tax_amount": "0",
  "credit_adjustment_status": "recorded",
  "recorded_at": "2026-08-17T21:00:00Z",
  "next_operator_action": "wait"
}
